{
    "document_title": "Income Tax Act : Revocation of registration of charities",
    "download_id": 2138615,
    "publication_name": "Canada Gazette",
    "title": "Income Tax Act : Revocation of registration of charities",
    "country": "Canada",
    "publication_issue": " Part I: Volume 152,Edition No. 17",
    "departments": [
        {
            "department_hierarchy": 0,
            "department_name": "Canada Revenue Agency"
        }
    ],
    "source_url": "http://gazette.gc.ca/rp-pr/p1/2018/2018-04-28/html/index-eng.html",
    "notice_type": "Notice or Proposed Rule",
    "publication_date": "2018-04-28",
    "document_id": 1800883
}
